{"timestamp": "2025-07-25T23:37:55.732043Z", "run_id": "run_24c2ae96fd5a4a8f97e84a992eb11c62", "workflow_name": "Unnamed Workflow", "task_key": "prepare_analysis_framework", "action_type": "generate_text_llm", "attempt": 1, "duration_sec": 11.8686, "inputs": {"prompt": "Prepare an analytical framework for advanced cognitive analysis of the problem. Define:\n1. Key analytical dimensions to explore\n2. Hypotheses to test\n3. Data requirements for analysis\n4. Success criteria for insights\n5. Integration points for specialized agent consultation\n\nProblem: null\nSpecialized Agent: null\nKnowledge Base: null\n\nProvide a comprehensive analytical framework in JSON format.", "model": "gemini-1.5-pro-latest", "temperature": 0.3, "max_tokens": 2000}, "result": {"result": {"response_text": "```json\n{\n  \"problem_statement\": \"No problem specified. This framework provides a template for any problem requiring cognitive analysis.\",\n  \"analytical_dimensions\": [\n    {\n      \"dimension\": \"Contextual Factors\",\n      \"description\": \"Understanding the surrounding environment and circumstances relevant to the problem.\",\n      \"subdimensions\": [\n        \"Historical context\",\n        \"Geographic context\",\n        \"Socioeconomic context\",\n        \"Political context\",\n        \"Technological context\"\n      ]\n    },\n    {\n      \"dimension\": \"Stakeholder Analysis\",\n      \"description\": \"Identifying and analyzing individuals or groups impacted by or influencing the problem.\",\n      \"subdimensions\": [\n        \"Stakeholder identification\",\n        \"Stakeholder interests\",\n        \"Stakeholder power and influence\",\n        \"Stakeholder relationships\"\n      ]\n    },\n    {\n      \"dimension\": \"Causal Factors\",\n      \"description\": \"Investigating the root causes and contributing factors leading to the problem.\",\n      \"subdimensions\": [\n        \"Direct causes\",\n        \"Indirect causes\",\n        \"Underlying causes\",\n        \"Triggering events\"\n      ]\n    },\n    {\n      \"dimension\": \"Potential Solutions\",\n      \"description\": \"Exploring and evaluating possible solutions to address the problem.\",\n      \"subdimensions\": [\n        \"Short-term solutions\",\n        \"Long-term solutions\",\n        \"Feasibility of solutions\",\n        \"Effectiveness of solutions\",\n        \"Unintended consequences\"\n      ]\n    }\n  ],\n  \"hypotheses\": [\n    {\n      \"hypothesis\": \"Placeholder Hypothesis 1\",\n      \"description\": \"This is a placeholder hypothesis and should be replaced with a specific, testable statement related to the problem.\",\n      \"testable_criteria\": \"Define specific criteria for testing this hypothesis.\"\n    },\n    {\n      \"hypothesis\": \"Placeholder Hypothesis 2\",\n      \"description\": \"This is a placeholder hypothesis and should be replaced with a specific, testable statement related to the problem.\",\n      \"testable_criteria\": \"Define specific criteria for testing this hypothesis.\"\n    }\n  ],\n  \"data_requirements\": [\n    {\n      \"data_type\": \"Qualitative Data\",\n      \"sources\": [\"Interviews\", \"Focus groups\", \"Case studies\", \"Expert opinions\"],\n      \"purpose\": \"Understanding perspectives, experiences, and underlying reasons.\"\n    },\n    {\n      \"data_type\": \"Quantitative Data\",\n      \"sources\": [\"Surveys\", \"Statistical data\", \"Performance metrics\", \"Financial records\"],\n      \"purpose\": \"Measuring and analyzing numerical data to identify trends and patterns.\"\n    }\n  ],\n  \"success_criteria\": [\n    \"Actionable insights that directly address the problem.\",\n    \"Evidence-based conclusions supported by data and analysis.\",\n    \"Identification of specific recommendations for intervention or improvement.\",\n    \"Clear and concise communication of findings to relevant stakeholders.\"\n  ],\n  \"integration_points_for_specialized_agent_consultation\": [\n    {\n      \"agent_type\": \"Placeholder Agent Type (e.g., Legal Expert, Data Scientist)\",\n      \"integration_point\": \"Data analysis and interpretation\",\n      \"purpose\": \"Leveraging specialized expertise to analyze complex data sets and extract meaningful insights.\"\n    },\n    {\n      \"agent_type\": \"Placeholder Agent Type (e.g., Subject Matter Expert)\",\n      \"integration_point\": \"Hypothesis validation and refinement\",\n      \"purpose\": \"Consulting with experts to validate hypotheses and ensure alignment with current knowledge and best practices.\"\n    }\n  ],\n  \"knowledge_base\": \"No specific knowledge base specified. Relevant knowledge bases should be identified based on the specific problem being analyzed.\"\n}\n```"}, "reflection": {"action_name": "generate_text", "timestamp_utc": 1753486687.6004677, "status": "Success", "confidence": 0.9, "summary_message": "Text generation completed successfully using gemini-1.5-pro-latest.", "inputs_preview": {"prompt": "Prepare an analytical framework for advanced cognitive analysis of the problem. Define:\n1. Key analy...", "model": "gemini-1.5-pro-latest", "temperature": "0.3", "max_tokens": "2000"}, "outputs_preview": {"response_text": "```json\n{\n  \"problem_statement\": \"No problem specified. This framework provides a template for any p..."}, "alignment_check": {"resonatia_protocol": "Alignment not assessed."}, "potential_issues": [], "execution_time_seconds": 11.86832046508789}}}
{"timestamp": "2025-07-25T23:38:07.600705Z", "run_id": "run_24c2ae96fd5a4a8f97e84a992eb11c62", "workflow_name": "Unnamed Workflow", "task_key": "generate_causal_hypotheses", "action_type": "generate_text_llm", "attempt": 1, "duration_sec": 10.0663, "inputs": {"prompt": "Generate specific causal hypotheses for advanced analysis of the problem. Focus on:\n1. Root cause analysis\n2. Chain of events analysis\n3. Motivational factors\n4. Systemic influences\n5. Predictive factors\n\nProblem: null\nAnalytical Framework: ```json\n{\n  \"problem_statement\": \"No problem specified. This framework provides a template for any problem requiring cognitive analysis.\",\n  \"analytical_dimensions\": [\n    {\n      \"dimension\": \"Contextual Factors\",\n      \"description\": \"Understanding the surrounding environment and circumstances relevant to the problem.\",\n      \"subdimensions\": [\n        \"Historical context\",\n        \"Geographic context\",\n        \"Socioeconomic context\",\n        \"Political context\",\n        \"Technological context\"\n      ]\n    },\n    {\n      \"dimension\": \"Stakeholder Analysis\",\n      \"description\": \"Identifying and analyzing individuals or groups impacted by or influencing the problem.\",\n      \"subdimensions\": [\n        \"Stakeholder identification\",\n        \"Stakeholder interests\",\n        \"Stakeholder power and influence\",\n        \"Stakeholder relationships\"\n      ]\n    },\n    {\n      \"dimension\": \"Causal Factors\",\n      \"description\": \"Investigating the root causes and contributing factors leading to the problem.\",\n      \"subdimensions\": [\n        \"Direct causes\",\n        \"Indirect causes\",\n        \"Underlying causes\",\n        \"Triggering events\"\n      ]\n    },\n    {\n      \"dimension\": \"Potential Solutions\",\n      \"description\": \"Exploring and evaluating possible solutions to address the problem.\",\n      \"subdimensions\": [\n        \"Short-term solutions\",\n        \"Long-term solutions\",\n        \"Feasibility of solutions\",\n        \"Effectiveness of solutions\",\n        \"Unintended consequences\"\n      ]\n    }\n  ],\n  \"hypotheses\": [\n    {\n      \"hypothesis\": \"Placeholder Hypothesis 1\",\n      \"description\": \"This is a placeholder hypothesis and should be replaced with a specific, testable statement related to the problem.\",\n      \"testable_criteria\": \"Define specific criteria for testing this hypothesis.\"\n    },\n    {\n      \"hypothesis\": \"Placeholder Hypothesis 2\",\n      \"description\": \"This is a placeholder hypothesis and should be replaced with a specific, testable statement related to the problem.\",\n      \"testable_criteria\": \"Define specific criteria for testing this hypothesis.\"\n    }\n  ],\n  \"data_requirements\": [\n    {\n      \"data_type\": \"Qualitative Data\",\n      \"sources\": [\"Interviews\", \"Focus groups\", \"Case studies\", \"Expert opinions\"],\n      \"purpose\": \"Understanding perspectives, experiences, and underlying reasons.\"\n    },\n    {\n      \"data_type\": \"Quantitative Data\",\n      \"sources\": [\"Surveys\", \"Statistical data\", \"Performance metrics\", \"Financial records\"],\n      \"purpose\": \"Measuring and analyzing numerical data to identify trends and patterns.\"\n    }\n  ],\n  \"success_criteria\": [\n    \"Actionable insights that directly address the problem.\",\n    \"Evidence-based conclusions supported by data and analysis.\",\n    \"Identification of specific recommendations for intervention or improvement.\",\n    \"Clear and concise communication of findings to relevant stakeholders.\"\n  ],\n  \"integration_points_for_specialized_agent_consultation\": [\n    {\n      \"agent_type\": \"Placeholder Agent Type (e.g., Legal Expert, Data Scientist)\",\n      \"integration_point\": \"Data analysis and interpretation\",\n      \"purpose\": \"Leveraging specialized expertise to analyze complex data sets and extract meaningful insights.\"\n    },\n    {\n      \"agent_type\": \"Placeholder Agent Type (e.g., Subject Matter Expert)\",\n      \"integration_point\": \"Hypothesis validation and refinement\",\n      \"purpose\": \"Consulting with experts to validate hypotheses and ensure alignment with current knowledge and best practices.\"\n    }\n  ],\n  \"knowledge_base\": \"No specific knowledge base specified. Relevant knowledge bases should be identified based on the specific problem being analyzed.\"\n}\n```\n\nProvide detailed causal hypotheses in JSON format.", "model": "gemini-1.5-pro-latest", "temperature": 0.4, "max_tokens": 2500}, "result": {"result": {"response_text": "```json\n{\n  \"problem_statement\": \"No problem specified. This framework provides hypotheses templates for any problem requiring cognitive analysis.\",\n  \"hypotheses\": [\n    {\n      \"category\": \"Root Cause Analysis\",\n      \"hypothesis\": \"The absence of a clearly defined problem statement hinders effective analysis and leads to unproductive outcomes.\",\n      \"description\": \"Without a specific problem to address, efforts are diffused and lack focus, preventing meaningful progress.\",\n      \"testable_criteria\": \"Measure the clarity and specificity of problem statements against the effectiveness of subsequent analyses (e.g., number of actionable insights generated).\"\n    },\n    {\n      \"category\": \"Chain of Events Analysis\",\n      \"hypothesis\": \"A lack of a defined problem leads to a chain of events where resources are allocated to irrelevant tasks, resulting in wasted time and effort.\",\n      \"description\": \"This hypothesis suggests a cascading effect where the initial lack of clarity triggers a series of unproductive actions.\",\n      \"testable_criteria\": \"Track resource allocation and task completion related to analysis efforts, comparing scenarios with and without clear problem statements.\"\n    },\n    {\n      \"category\": \"Motivational Factors\",\n      \"hypothesis\": \"The absence of a tangible problem diminishes motivation among analysts, leading to decreased engagement and lower quality work.\",\n      \"description\": \"This explores the psychological impact of lacking a clear objective, potentially affecting intrinsic motivation and sense of purpose.\",\n      \"testable_criteria\": \"Assess analyst engagement (e.g., through surveys, participation in discussions) and the quality of analytical outputs in situations with varying levels of problem definition.\"\n    },\n    {\n      \"category\": \"Systemic Influences\",\n      \"hypothesis\": \"Organizational structures that do not prioritize clear problem definition contribute to a culture of reactive, rather than proactive, problem-solving.\",\n      \"description\": \"This hypothesis examines how systemic factors within an organization can perpetuate a lack of clarity in problem identification.\",\n      \"testable_criteria\": \"Analyze organizational processes related to problem definition and resource allocation, comparing them to observed problem-solving behaviors (reactive vs. proactive).\"\n    },\n    {\n      \"category\": \"Predictive Factors\",\n      \"hypothesis\": \"The degree of problem definition at the outset of an analysis is a strong predictor of the eventual success and impact of the analysis.\",\n      \"description\": \"This suggests a direct correlation between the initial clarity of the problem and the ultimate effectiveness of the analysis.\",\n      \"testable_criteria\": \"Measure the level of problem definition at the start of multiple analyses and compare it to the measured success and impact of those analyses, using metrics like solution implementation rates and achieved outcomes.\"\n    }\n  ]\n}\n```"}, "reflection": {"action_name": "generate_text", "timestamp_utc": 1753486697.6668806, "status": "Success", "confidence": 0.9, "summary_message": "Text generation completed successfully using gemini-1.5-pro-latest.", "inputs_preview": {"prompt": "Generate specific causal hypotheses for advanced analysis of the problem. Focus on:\n1. Root cause an...", "model": "gemini-1.5-pro-latest", "temperature": "0.4", "max_tokens": "2500"}, "outputs_preview": {"response_text": "```json\n{\n  \"problem_statement\": \"No problem specified. This framework provides hypotheses templates..."}, "alignment_check": {"resonatia_protocol": "Alignment not assessed."}, "potential_issues": [], "execution_time_seconds": 10.066097021102905}}}
{"timestamp": "2025-07-25T23:38:17.667084Z", "run_id": "run_24c2ae96fd5a4a8f97e84a992eb11c62", "workflow_name": "Unnamed Workflow", "task_key": "execute_causal_inference", "action_type": "causal_inference_tool", "attempt": 1, "duration_sec": 0.0009, "inputs": {"data": null, "hypotheses": "```json\n{\n  \"problem_statement\": \"No problem specified. This framework provides hypotheses templates for any problem requiring cognitive analysis.\",\n  \"hypotheses\": [\n    {\n      \"category\": \"Root Cause Analysis\",\n      \"hypothesis\": \"The absence of a clearly defined problem statement hinders effective analysis and leads to unproductive outcomes.\",\n      \"description\": \"Without a specific problem to address, efforts are diffused and lack focus, preventing meaningful progress.\",\n      \"testable_criteria\": \"Measure the clarity and specificity of problem statements against the effectiveness of subsequent analyses (e.g., number of actionable insights generated).\"\n    },\n    {\n      \"category\": \"Chain of Events Analysis\",\n      \"hypothesis\": \"A lack of a defined problem leads to a chain of events where resources are allocated to irrelevant tasks, resulting in wasted time and effort.\",\n      \"description\": \"This hypothesis suggests a cascading effect where the initial lack of clarity triggers a series of unproductive actions.\",\n      \"testable_criteria\": \"Track resource allocation and task completion related to analysis efforts, comparing scenarios with and without clear problem statements.\"\n    },\n    {\n      \"category\": \"Motivational Factors\",\n      \"hypothesis\": \"The absence of a tangible problem diminishes motivation among analysts, leading to decreased engagement and lower quality work.\",\n      \"description\": \"This explores the psychological impact of lacking a clear objective, potentially affecting intrinsic motivation and sense of purpose.\",\n      \"testable_criteria\": \"Assess analyst engagement (e.g., through surveys, participation in discussions) and the quality of analytical outputs in situations with varying levels of problem definition.\"\n    },\n    {\n      \"category\": \"Systemic Influences\",\n      \"hypothesis\": \"Organizational structures that do not prioritize clear problem definition contribute to a culture of reactive, rather than proactive, problem-solving.\",\n      \"description\": \"This hypothesis examines how systemic factors within an organization can perpetuate a lack of clarity in problem identification.\",\n      \"testable_criteria\": \"Analyze organizational processes related to problem definition and resource allocation, comparing them to observed problem-solving behaviors (reactive vs. proactive).\"\n    },\n    {\n      \"category\": \"Predictive Factors\",\n      \"hypothesis\": \"The degree of problem definition at the outset of an analysis is a strong predictor of the eventual success and impact of the analysis.\",\n      \"description\": \"This suggests a direct correlation between the initial clarity of the problem and the ultimate effectiveness of the analysis.\",\n      \"testable_criteria\": \"Measure the level of problem definition at the start of multiple analyses and compare it to the measured success and impact of those analyses, using metrics like solution implementation rates and achieved outcomes.\"\n    }\n  ]\n}\n```", "method": "backdoor.linear_regression", "confidence_level": 0.95}, "result": {"operation_performed": {"data": null, "hypotheses": "```json\n{\n  \"problem_statement\": \"No problem specified. This framework provides hypotheses templates for any problem requiring cognitive analysis.\",\n  \"hypotheses\": [\n    {\n      \"category\": \"Root Cause Analysis\",\n      \"hypothesis\": \"The absence of a clearly defined problem statement hinders effective analysis and leads to unproductive outcomes.\",\n      \"description\": \"Without a specific problem to address, efforts are diffused and lack focus, preventing meaningful progress.\",\n      \"testable_criteria\": \"Measure the clarity and specificity of problem statements against the effectiveness of subsequent analyses (e.g., number of actionable insights generated).\"\n    },\n    {\n      \"category\": \"Chain of Events Analysis\",\n      \"hypothesis\": \"A lack of a defined problem leads to a chain of events where resources are allocated to irrelevant tasks, resulting in wasted time and effort.\",\n      \"description\": \"This hypothesis suggests a cascading effect where the initial lack of clarity triggers a series of unproductive actions.\",\n      \"testable_criteria\": \"Track resource allocation and task completion related to analysis efforts, comparing scenarios with and without clear problem statements.\"\n    },\n    {\n      \"category\": \"Motivational Factors\",\n      \"hypothesis\": \"The absence of a tangible problem diminishes motivation among analysts, leading to decreased engagement and lower quality work.\",\n      \"description\": \"This explores the psychological impact of lacking a clear objective, potentially affecting intrinsic motivation and sense of purpose.\",\n      \"testable_criteria\": \"Assess analyst engagement (e.g., through surveys, participation in discussions) and the quality of analytical outputs in situations with varying levels of problem definition.\"\n    },\n    {\n      \"category\": \"Systemic Influences\",\n      \"hypothesis\": \"Organizational structures that do not prioritize clear problem definition contribute to a culture of reactive, rather than proactive, problem-solving.\",\n      \"description\": \"This hypothesis examines how systemic factors within an organization can perpetuate a lack of clarity in problem identification.\",\n      \"testable_criteria\": \"Analyze organizational processes related to problem definition and resource allocation, comparing them to observed problem-solving behaviors (reactive vs. proactive).\"\n    },\n    {\n      \"category\": \"Predictive Factors\",\n      \"hypothesis\": \"The degree of problem definition at the outset of an analysis is a strong predictor of the eventual success and impact of the analysis.\",\n      \"description\": \"This suggests a direct correlation between the initial clarity of the problem and the ultimate effectiveness of the analysis.\",\n      \"testable_criteria\": \"Measure the level of problem definition at the start of multiple analyses and compare it to the measured success and impact of those analyses, using metrics like solution implementation rates and achieved outcomes.\"\n    }\n  ]\n}\n```", "method": "backdoor.linear_regression", "confidence_level": 0.95}, "error": "Unsupported or unsimulated causal operation: {'data': None, 'hypotheses': '```json\\n{\\n  \"problem_statement\": \"No problem specified. This framework provides hypotheses templates for any problem requiring cognitive analysis.\",\\n  \"hypotheses\": [\\n    {\\n      \"category\": \"Root Cause Analysis\",\\n      \"hypothesis\": \"The absence of a clearly defined problem statement hinders effective analysis and leads to unproductive outcomes.\",\\n      \"description\": \"Without a specific problem to address, efforts are diffused and lack focus, preventing meaningful progress.\",\\n      \"testable_criteria\": \"Measure the clarity and specificity of problem statements against the effectiveness of subsequent analyses (e.g., number of actionable insights generated).\"\\n    },\\n    {\\n      \"category\": \"Chain of Events Analysis\",\\n      \"hypothesis\": \"A lack of a defined problem leads to a chain of events where resources are allocated to irrelevant tasks, resulting in wasted time and effort.\",\\n      \"description\": \"This hypothesis suggests a cascading effect where the initial lack of clarity triggers a series of unproductive actions.\",\\n      \"testable_criteria\": \"Track resource allocation and task completion related to analysis efforts, comparing scenarios with and without clear problem statements.\"\\n    },\\n    {\\n      \"category\": \"Motivational Factors\",\\n      \"hypothesis\": \"The absence of a tangible problem diminishes motivation among analysts, leading to decreased engagement and lower quality work.\",\\n      \"description\": \"This explores the psychological impact of lacking a clear objective, potentially affecting intrinsic motivation and sense of purpose.\",\\n      \"testable_criteria\": \"Assess analyst engagement (e.g., through surveys, participation in discussions) and the quality of analytical outputs in situations with varying levels of problem definition.\"\\n    },\\n    {\\n      \"category\": \"Systemic Influences\",\\n      \"hypothesis\": \"Organizational structures that do not prioritize clear problem definition contribute to a culture of reactive, rather than proactive, problem-solving.\",\\n      \"description\": \"This hypothesis examines how systemic factors within an organization can perpetuate a lack of clarity in problem identification.\",\\n      \"testable_criteria\": \"Analyze organizational processes related to problem definition and resource allocation, comparing them to observed problem-solving behaviors (reactive vs. proactive).\"\\n    },\\n    {\\n      \"category\": \"Predictive Factors\",\\n      \"hypothesis\": \"The degree of problem definition at the outset of an analysis is a strong predictor of the eventual success and impact of the analysis.\",\\n      \"description\": \"This suggests a direct correlation between the initial clarity of the problem and the ultimate effectiveness of the analysis.\",\\n      \"testable_criteria\": \"Measure the level of problem definition at the start of multiple analyses and compare it to the measured success and impact of those analyses, using metrics like solution implementation rates and achieved outcomes.\"\\n    }\\n  ]\\n}\\n```', 'method': 'backdoor.linear_regression', 'confidence_level': 0.95}", "libs_available": true, "note": "", "reflection": {"status": "Failure", "summary": "Causal op '{'data': None, 'hypotheses': '```json\\n{\\n  \"problem_statement\": \"No problem specified. This framework provides hypotheses templates for any problem requiring cognitive analysis.\",\\n  \"hypotheses\": [\\n    {\\n      \"category\": \"Root Cause Analysis\",\\n      \"hypothesis\": \"The absence of a clearly defined problem statement hinders effective analysis and leads to unproductive outcomes.\",\\n      \"description\": \"Without a specific problem to address, efforts are diffused and lack focus, preventing meaningful progress.\",\\n      \"testable_criteria\": \"Measure the clarity and specificity of problem statements against the effectiveness of subsequent analyses (e.g., number of actionable insights generated).\"\\n    },\\n    {\\n      \"category\": \"Chain of Events Analysis\",\\n      \"hypothesis\": \"A lack of a defined problem leads to a chain of events where resources are allocated to irrelevant tasks, resulting in wasted time and effort.\",\\n      \"description\": \"This hypothesis suggests a cascading effect where the initial lack of clarity triggers a series of unproductive actions.\",\\n      \"testable_criteria\": \"Track resource allocation and task completion related to analysis efforts, comparing scenarios with and without clear problem statements.\"\\n    },\\n    {\\n      \"category\": \"Motivational Factors\",\\n      \"hypothesis\": \"The absence of a tangible problem diminishes motivation among analysts, leading to decreased engagement and lower quality work.\",\\n      \"description\": \"This explores the psychological impact of lacking a clear objective, potentially affecting intrinsic motivation and sense of purpose.\",\\n      \"testable_criteria\": \"Assess analyst engagement (e.g., through surveys, participation in discussions) and the quality of analytical outputs in situations with varying levels of problem definition.\"\\n    },\\n    {\\n      \"category\": \"Systemic Influences\",\\n      \"hypothesis\": \"Organizational structures that do not prioritize clear problem definition contribute to a culture of reactive, rather than proactive, problem-solving.\",\\n      \"description\": \"This hypothesis examines how systemic factors within an organization can perpetuate a lack of clarity in problem identification.\",\\n      \"testable_criteria\": \"Analyze organizational processes related to problem definition and resource allocation, comparing them to observed problem-solving behaviors (reactive vs. proactive).\"\\n    },\\n    {\\n      \"category\": \"Predictive Factors\",\\n      \"hypothesis\": \"The degree of problem definition at the outset of an analysis is a strong predictor of the eventual success and impact of the analysis.\",\\n      \"description\": \"This suggests a direct correlation between the initial clarity of the problem and the ultimate effectiveness of the analysis.\",\\n      \"testable_criteria\": \"Measure the level of problem definition at the start of multiple analyses and compare it to the measured success and impact of those analyses, using metrics like solution implementation rates and achieved outcomes.\"\\n    }\\n  ]\\n}\\n```', 'method': 'backdoor.linear_regression', 'confidence_level': 0.95}' failed: Unsupported or unsimulated causal operation: {'data': None, 'hypotheses': '```json\\n{\\n  \"problem_statement\": \"No problem specified. This framework provides hypotheses templates for any problem requiring cognitive analysis.\",\\n  \"hypotheses\": [\\n    {\\n      \"category\": \"Root Cause Analysis\",\\n      \"hypothesis\": \"The absence of a clearly defined problem statement hinders effective analysis and leads to unproductive outcomes.\",\\n      \"description\": \"Without a specific problem to address, efforts are diffused and lack focus, preventing meaningful progress.\",\\n      \"testable_criteria\": \"Measure the clarity and specificity of problem statements against the effectiveness of subsequent analyses (e.g., number of actionable insights generated).\"\\n    },\\n    {\\n      \"category\": \"Chain of Events Analysis\",\\n      \"hypothesis\": \"A lack of a defined problem leads to a chain of events where resources are allocated to irrelevant tasks, resulting in wasted time and effort.\",\\n      \"description\": \"This hypothesis suggests a cascading effect where the initial lack of clarity triggers a series of unproductive actions.\",\\n      \"testable_criteria\": \"Track resource allocation and task completion related to analysis efforts, comparing scenarios with and without clear problem statements.\"\\n    },\\n    {\\n      \"category\": \"Motivational Factors\",\\n      \"hypothesis\": \"The absence of a tangible problem diminishes motivation among analysts, leading to decreased engagement and lower quality work.\",\\n      \"description\": \"This explores the psychological impact of lacking a clear objective, potentially affecting intrinsic motivation and sense of purpose.\",\\n      \"testable_criteria\": \"Assess analyst engagement (e.g., through surveys, participation in discussions) and the quality of analytical outputs in situations with varying levels of problem definition.\"\\n    },\\n    {\\n      \"category\": \"Systemic Influences\",\\n      \"hypothesis\": \"Organizational structures that do not prioritize clear problem definition contribute to a culture of reactive, rather than proactive, problem-solving.\",\\n      \"description\": \"This hypothesis examines how systemic factors within an organization can perpetuate a lack of clarity in problem identification.\",\\n      \"testable_criteria\": \"Analyze organizational processes related to problem definition and resource allocation, comparing them to observed problem-solving behaviors (reactive vs. proactive).\"\\n    },\\n    {\\n      \"category\": \"Predictive Factors\",\\n      \"hypothesis\": \"The degree of problem definition at the outset of an analysis is a strong predictor of the eventual success and impact of the analysis.\",\\n      \"description\": \"This suggests a direct correlation between the initial clarity of the problem and the ultimate effectiveness of the analysis.\",\\n      \"testable_criteria\": \"Measure the level of problem definition at the start of multiple analyses and compare it to the measured success and impact of those analyses, using metrics like solution implementation rates and achieved outcomes.\"\\n    }\\n  ]\\n}\\n```', 'method': 'backdoor.linear_regression', 'confidence_level': 0.95}", "confidence": 0.1, "alignment_check": "N/A", "potential_issues": ["Unsupported or unsimulated causal operation: {'data': None, 'hypotheses': '```json\\n{\\n  \"problem_statement\": \"No problem specified. This framework provides hypotheses templates for any problem requiring cognitive analysis.\",\\n  \"hypotheses\": [\\n    {\\n      \"category\": \"Root Cause Analysis\",\\n      \"hypothesis\": \"The absence of a clearly defined problem statement hinders effective analysis and leads to unproductive outcomes.\",\\n      \"description\": \"Without a specific problem to address, efforts are diffused and lack focus, preventing meaningful progress.\",\\n      \"testable_criteria\": \"Measure the clarity and specificity of problem statements against the effectiveness of subsequent analyses (e.g., number of actionable insights generated).\"\\n    },\\n    {\\n      \"category\": \"Chain of Events Analysis\",\\n      \"hypothesis\": \"A lack of a defined problem leads to a chain of events where resources are allocated to irrelevant tasks, resulting in wasted time and effort.\",\\n      \"description\": \"This hypothesis suggests a cascading effect where the initial lack of clarity triggers a series of unproductive actions.\",\\n      \"testable_criteria\": \"Track resource allocation and task completion related to analysis efforts, comparing scenarios with and without clear problem statements.\"\\n    },\\n    {\\n      \"category\": \"Motivational Factors\",\\n      \"hypothesis\": \"The absence of a tangible problem diminishes motivation among analysts, leading to decreased engagement and lower quality work.\",\\n      \"description\": \"This explores the psychological impact of lacking a clear objective, potentially affecting intrinsic motivation and sense of purpose.\",\\n      \"testable_criteria\": \"Assess analyst engagement (e.g., through surveys, participation in discussions) and the quality of analytical outputs in situations with varying levels of problem definition.\"\\n    },\\n    {\\n      \"category\": \"Systemic Influences\",\\n      \"hypothesis\": \"Organizational structures that do not prioritize clear problem definition contribute to a culture of reactive, rather than proactive, problem-solving.\",\\n      \"description\": \"This hypothesis examines how systemic factors within an organization can perpetuate a lack of clarity in problem identification.\",\\n      \"testable_criteria\": \"Analyze organizational processes related to problem definition and resource allocation, comparing them to observed problem-solving behaviors (reactive vs. proactive).\"\\n    },\\n    {\\n      \"category\": \"Predictive Factors\",\\n      \"hypothesis\": \"The degree of problem definition at the outset of an analysis is a strong predictor of the eventual success and impact of the analysis.\",\\n      \"description\": \"This suggests a direct correlation between the initial clarity of the problem and the ultimate effectiveness of the analysis.\",\\n      \"testable_criteria\": \"Measure the level of problem definition at the start of multiple analyses and compare it to the measured success and impact of those analyses, using metrics like solution implementation rates and achieved outcomes.\"\\n    }\\n  ]\\n}\\n```', 'method': 'backdoor.linear_regression', 'confidence_level': 0.95}"], "raw_output_preview": "None"}}}
